<?xml version="1.0" encoding="UTF-8"?>

<xs:schema xmlns:xs="http://www.w3.org/2001/XMLSchema">

    <xs:element name="employees">
        <xs:complexType>
            <xs:sequence>

                <xs:element name="employee" maxOccurs="unbounded">
                    <xs:complexType>
                        <xs:sequence>
                            <xs:element name="name" type="xs:string"/>
                            <xs:element name="department" type="xs:string"/>
                            <xs:element name="designation" type="xs:string"/>
                            <xs:element name="salary" type="xs:decimal"/>
                            <xs:element name="email" type="xs:string"/>
                        </xs:sequence>

                        <xs:attribute name="empId"
                                      type="xs:string"
                                      use="required"/>
                    </xs:complexType>
                </xs:element>

            </xs:sequence>
        </xs:complexType>
    </xs:element>

</xs:schema>
